id,number,title,state,created_at,closed_at,comments,close_duration_days,is_closed
3265376571,61961,Backport PR #61921 on branch 2.3.x (DOC: explicitly mention new str dtype is no longer a numpy dtype in migration guide),closed,2025-07-26 09:19:28+00:00,2025-07-26 11:33:33+00:00,0,0,1
3265364121,61960,DOC: update .str.contains/match/startswith docstring examples for default  behaviour,closed,2025-07-26 09:04:32+00:00,2025-07-28 16:50:49+00:00,1,2,1
3265354656,61959,Backport PR #61958 on branch 2.3.x (DOC: Add release notes template for 2.3.2),closed,2025-07-26 08:53:23+00:00,2025-07-26 09:27:37+00:00,0,0,1
3265328560,61958,DOC: Add release notes template for 2.3.2,closed,2025-07-26 08:19:40+00:00,2025-07-26 08:52:55+00:00,0,0,1
3265174806,61957,Flattened footer,closed,2025-07-26 06:06:18+00:00,2025-08-02 03:09:15+00:00,6,6,1
3265051457,61956,DOC: added button to edit on GitHub,closed,2025-07-26 04:01:58+00:00,2025-10-05 21:17:11+00:00,14,71,1
3264517043,61955,DOC: shift argument in `Series.shift()` is not used,closed,2025-07-25 22:14:34+00:00,2025-08-18 15:50:36+00:00,2,23,1
3263981792,61954,docs: Improve README with helpful contributor resources,closed,2025-07-25 18:00:22+00:00,2025-07-25 19:10:18+00:00,1,0,1
3263967922,61953,docs: Improve README with helpful contributor resources,closed,2025-07-25 17:54:00+00:00,2025-07-25 17:55:48+00:00,0,0,1
3263943096,61952,BUG: Using `Series.str.fullmatch()` and `Series.str.match()` with a compiled regex fails with arrow strings,closed,2025-07-25 17:43:38+00:00,2025-08-14 06:20:28+00:00,2,19,1
3263634189,61950,TST: run python-dev CI on 3.14-dev,closed,2025-07-25 15:37:55+00:00,2025-09-11 07:20:33+00:00,16,47,1
3263423538,61948,BUG: Replacement fails after NA value with PyArrow-backed strings,closed,2025-07-25 14:28:33+00:00,2025-07-25 18:17:20+00:00,1,0,1
3263291757,61947,CI: enable doctest errors again + fixup categorical examples,closed,2025-07-25 13:46:35+00:00,2025-07-26 17:14:21+00:00,1,1,1
3262892048,61946,BUG: Fix Series.str.contains with compiled regex on Arrow string dtype,closed,2025-07-25 11:21:33+00:00,2025-08-14 08:27:10+00:00,13,19,1
3262764488,61945,BUG: Fix Series.str.contains with compiled regex on Arrow strings (#61942),closed,2025-07-25 10:32:26+00:00,2025-07-25 10:35:39+00:00,0,0,1
3261825366,61944,DOC: Standardize noncompliant docstrings in pandas/io/html.py (flake8-docstrings),closed,2025-07-25 02:59:21+00:00,2025-09-09 00:35:19+00:00,8,45,1
3261452864,61942,BUG: Using `Series.str.contains()` with a compiled regex and arrow strings fails,closed,2025-07-24 22:44:11+00:00,2025-08-14 08:27:11+00:00,0,20,1
3261447335,61941,BUG: Fix TypeError in assert_index_equal when comparing CategoricalIndex with check_categorical=True and exact=False,closed,2025-07-24 22:40:10+00:00,2025-10-03 17:17:37+00:00,16,70,1
3261383708,61940,BUG: Using `/` operator with a `Path` and `Series` of string dtype fails,closed,2025-07-24 22:02:26+00:00,2025-09-02 16:36:16+00:00,8,39,1
3261317149,61939,DOC: Docstring for BooleanDType inconsistent with the rest of repo,closed,2025-07-24 21:27:51+00:00,2025-11-04 12:51:45+00:00,10,102,1
3261106428,61936,Issue #14601 fix - pytables.py put() and append() docstring fix,closed,2025-07-24 20:08:56+00:00,2025-07-25 16:01:32+00:00,5,0,1
3260721290,61935,"BUG: `assert_index_equal(CategoricalIndex, CategoricalIndex, check_categorical=True, exact=False)` raises TypeError instead of AssertionError",closed,2025-07-24 17:48:56+00:00,2025-10-03 17:17:39+00:00,0,70,1
3260664864,61934,Backport PR #61933 on branch 2.3.x (unpin scipy since statsmodels was fixed),closed,2025-07-24 17:29:41+00:00,2025-07-24 20:02:20+00:00,0,0,1
3260304428,61933,unpin scipy since statsmodels was fixed,closed,2025-07-24 15:22:34+00:00,2025-07-24 16:14:39+00:00,3,0,1
3259108800,61932,"BUG: Unexpected Code Segment Executed, Causing Logical Error",closed,2025-07-24 09:04:20+00:00,2025-07-24 20:04:05+00:00,2,0,1
3258438675,61931,DOC: Add tzdata to README dependencies list,closed,2025-07-24 04:23:43+00:00,2025-07-25 16:37:24+00:00,1,1,1
3256028981,61929,Updating error message to include more details about dataframe,closed,2025-07-23 11:39:47+00:00,2025-10-05 21:05:52+00:00,8,74,1
3255574178,61928,indexing with a `Categorical` of `Interval`s is inefficient,closed,2025-07-23 09:10:02+00:00,2026-03-15 18:48:55+00:00,3,235,1
3254677663,61927,DOC: Add tzdata to dependencies section in README,closed,2025-07-23 03:11:10+00:00,2025-07-25 16:37:25+00:00,1,2,1
3254654777,61926,BUG: Merge fails on pyarrow datetime columns,closed,2025-07-23 02:57:47+00:00,2025-10-06 16:22:59+00:00,14,75,1
3254290694,61925,"CoW: add readonly flag to ExtensionArrays, return read-only EA/ndarray in .array/EA.to_numpy()",closed,2025-07-22 22:51:04+00:00,2025-11-07 18:18:26+00:00,7,107,1
3254048673,61924,BUG: fix indexing with ArrowExtensionArray in .iloc,closed,2025-07-22 20:52:12+00:00,2025-08-05 17:21:47+00:00,4,13,1
3252361944,61923,fix: list numbering in roadmap.md,closed,2025-07-22 11:52:06+00:00,2025-07-22 16:28:28+00:00,1,0,1
3252117914,61922,"BUG: `date_range` gives different output ends for fixed `end` and varying `start` when `freq=""B""`",closed,2025-07-22 10:30:51+00:00,2025-07-22 20:27:57+00:00,2,0,1
3251462170,61921,DOC: explicitly mention new str dtype is no longer a numpy dtype in migration guide,closed,2025-07-22 07:28:09+00:00,2025-07-26 09:19:22+00:00,1,4,1
3251415957,61920,BUG: IntervalIndex.unique() only contains the first interval if all interval borders are negative,closed,2025-07-22 07:12:08+00:00,2025-11-25 21:10:02+00:00,23,126,1
3250175829,61919,"Update v3.0.0.rst to use Month XX, 2025 instead of 2024",closed,2025-07-21 22:12:06+00:00,2025-07-22 02:14:12+00:00,1,0,1
3250024508,61918,QST: Global future flag,closed,2025-07-21 20:55:32+00:00,2025-07-21 21:27:25+00:00,1,0,1
3249292932,61917,BUG: `IntervalIndex.unique()` only contains the first interval if all interval borders are negative,closed,2025-07-21 16:29:54+00:00,2025-11-25 21:10:03+00:00,4,127,1
3248660362,61916,"String dtype: backwards compatibility of selecting ""object"" vs ""str"" columns in `select_dtypes`",closed,2025-07-21 13:24:05+00:00,2025-10-19 20:10:40+00:00,3,90,1
3247701580,61915,BUG: Cannot interpret string dtype as a valid data type,closed,2025-07-21 08:31:47+00:00,2025-07-26 09:20:33+00:00,3,5,1
3246261681,61913,CI: properly enable the string dtype also for custom CI builds,closed,2025-07-20 10:57:02+00:00,2025-07-21 16:34:21+00:00,1,1,1
3246237183,61912,DOC: mention .attrs are preserved in Parquet IO for pyarrow engine,closed,2025-07-20 10:19:28+00:00,2025-10-05 21:20:10+00:00,5,77,1
3246075387,61911,DOC: fix doctests for datetimelike.py files for the new string dtype,closed,2025-07-20 06:50:55+00:00,2025-07-20 11:03:14+00:00,0,0,1
3246036129,61910,BUG: .describe() doesn't work for EAs #61707,closed,2025-07-20 06:10:36+00:00,2025-10-05 21:09:26+00:00,4,77,1
3245538156,61909,BUG: fix fill value for gouped sum in case of unobserved categories for string dtype (empty string instead of 0),closed,2025-07-19 18:28:34+00:00,2025-07-22 07:20:02+00:00,2,2,1
3245525510,61908,DOC: fix doctests for pandas/core/strings/accessor.py for new string dtype,closed,2025-07-19 18:17:39+00:00,2025-07-25 13:28:58+00:00,5,5,1
3245497141,61907,DOC: fix doctests for pandas/core/generic.py for new string dtype,closed,2025-07-19 17:49:17+00:00,2025-07-21 11:10:44+00:00,1,1,1
3245171453,61906,ENH: Make attributes saved by default,closed,2025-07-19 10:03:08+00:00,2025-07-21 03:02:18+00:00,3,1,1
3245115855,61905,DOC: fix doctests for pandas/core/base.py for new string dtype,closed,2025-07-19 08:38:03+00:00,2025-07-22 22:55:27+00:00,0,3,1
3245006696,61904,DOC: Clarify to_numeric behavior for numeric dtypes,closed,2025-07-19 06:46:56+00:00,2025-07-21 20:53:49+00:00,1,2,1
3244997539,61903,DOC: Clarify to_numeric behavior for numeric dtypes,closed,2025-07-19 06:39:17+00:00,2025-07-21 20:53:50+00:00,2,2,1
3244994973,61902,BUG: Raise ParserWarning when on_bad_lines is callable and index_col is set (GH#61882),closed,2025-07-19 06:36:25+00:00,2025-10-05 21:29:38+00:00,5,78,1
3243915646,61901,DEPR: maybe_infer_ndim,closed,2025-07-18 17:41:21+00:00,2025-07-21 16:44:14+00:00,1,2,1
3243872893,61900,BUG: fix to_json() with JSON Table Schema work correctly with string dtype,closed,2025-07-18 17:23:32+00:00,2025-07-26 11:27:37+00:00,3,7,1
3243815941,61899,FIX: Correct clip behavior test for lower > upper case,closed,2025-07-18 16:58:32+00:00,2025-07-19 03:35:22+00:00,0,0,1
3243700044,61898,BUG: `AttributeError` in `pd.eval()` when calling attribute after binary operation,closed,2025-07-18 16:08:05+00:00,2025-07-18 16:13:34+00:00,2,0,1
3243647605,61897,DEPR: PeriodDtype.freq,closed,2025-07-18 15:47:52+00:00,2026-02-17 21:02:54+00:00,10,214,1
3241608318,61895,Adding examples _typing.py,closed,2025-07-18 02:18:23+00:00,2025-07-18 16:40:14+00:00,1,0,1
3240626835,61894,BUG: fix padding for string categories in CategoricalIndex repr,closed,2025-07-17 19:10:04+00:00,2025-07-19 10:34:28+00:00,2,1,1
3240570216,61893,BUG: Fix concat dtype preservation through concat,closed,2025-07-17 18:53:02+00:00,2025-07-22 15:32:00+00:00,2,4,1
3239767398,61892,WEB: Remove Roadmap points pending a PDEP section from Roadmap,closed,2025-07-17 14:16:07+00:00,2025-07-22 16:27:33+00:00,2,5,1
3238615955,61891,Output formatting: preserve quoting for string categories,closed,2025-07-17 08:18:05+00:00,2025-07-25 13:26:36+00:00,3,8,1
3238501704,61890,Output formatting: the repr of the Categorical categories (quoted or unquoted strings?),closed,2025-07-17 07:41:48+00:00,2025-08-13 19:57:02+00:00,7,27,1
3238470835,61889,BUG: make to_json with JSON Table Schema work correctly with string dtype,closed,2025-07-17 07:30:55+00:00,2025-07-26 11:27:38+00:00,4,9,1
3238455184,61888,ENH: Images embedded in cells. The DISPIMG function of WPS,closed,2025-07-17 07:26:02+00:00,2025-08-05 16:28:29+00:00,11,19,1
3238410906,61887,DOC: fix doctests for string dtype changes (top-level),closed,2025-07-17 07:08:32+00:00,2025-07-17 14:59:03+00:00,1,0,1
3238405429,61886,DOC: fix doctests for repr changes with the new string dtype,closed,2025-07-17 07:06:43+00:00,2025-07-26 17:14:22+00:00,9,9,1
3238123884,61885,Fix warning for extra fields in read_csv with on_bad_lines callable,closed,2025-07-17 05:01:15+00:00,2025-07-29 01:01:52+00:00,2,11,1
3237427949,61884,API: Index.__cmp__(Series) return NotImplemented,closed,2025-07-16 21:42:36+00:00,2025-07-16 23:50:26+00:00,1,0,1
3237298600,61883,BUG: Timedelta with invalid keyword,closed,2025-07-16 20:38:53+00:00,2025-07-16 21:40:23+00:00,1,0,1
3237278110,61882,BUG: disallow exotic np.datetime64 unit,closed,2025-07-16 20:31:24+00:00,2025-07-17 19:21:20+00:00,1,0,1
3237151939,61880,Set up ty in CI,closed,2025-07-16 19:46:36+00:00,2025-07-28 17:14:13+00:00,1,11,1
3237012125,61879,DOC: Document that str.match accepts a regular expression,closed,2025-07-16 18:52:17+00:00,2025-08-31 10:29:58+00:00,2,45,1
3236918446,61878,DOC: update Parquet IO user guide on index handling and type support across engines,closed,2025-07-16 18:16:55+00:00,2025-07-16 21:29:00+00:00,1,0,1
3236839383,61877,DOC: show Parquet examples with default engine (without explicit pyarrow/fastparquet engine keyword),closed,2025-07-16 17:54:14+00:00,2025-07-16 21:27:45+00:00,1,0,1
3236796639,61876,ERR: improve exception message from timedelta64-datetime64,closed,2025-07-16 17:41:05+00:00,2025-07-16 21:30:16+00:00,1,0,1
3236633105,61875,API: IncompatibleFrequency subclass TypeError,closed,2025-07-16 16:42:14+00:00,2025-07-18 00:53:24+00:00,1,1,1
3236428918,61874,API: np.isinf on Index return Index[bool],closed,2025-07-16 15:32:29+00:00,2025-07-16 16:26:06+00:00,1,0,1
3235888714,61873,BUG:float_precision type hints differ in release version from github and docs pandas==2.3.1,closed,2025-07-16 13:01:08+00:00,2025-07-22 12:26:03+00:00,1,5,1
3235305025,61872,TST: add test for `dtype` argument in `str.decode`,closed,2025-07-16 10:08:10+00:00,2025-07-28 17:24:05+00:00,1,12,1
3234645403,61871,BUG FIX: None of the included dtypes present in df will raise ValueError with clear error message.,closed,2025-07-16 06:22:56+00:00,2025-10-05 22:22:26+00:00,5,81,1
3234406455,61870,BUG: Fix inconsistency with DateOffset near DST,closed,2025-07-16 04:29:43+00:00,2026-03-26 03:09:38+00:00,4,252,1
3234352456,61869,BUG: Fix logical method Non 1D Extension Arrays,closed,2025-07-16 03:54:25+00:00,2025-07-16 15:41:18+00:00,1,0,1
3233935527,61868,DOC: Add Raises section to to_numeric docstring,closed,2025-07-15 23:14:46+00:00,2025-07-16 16:29:47+00:00,2,0,1
3233725225,61867,Fix logical operations broadcasting for 2D ExtensionArrays,closed,2025-07-15 21:16:38+00:00,2025-07-15 21:39:48+00:00,1,0,1
3233525321,61866,BUG:  Operations not implemented for non-1D ExtensionArrays ,closed,2025-07-15 19:55:29+00:00,2025-08-14 22:39:02+00:00,2,30,1
3232796055,61865,DOC: Simplify footer wording in documentation (#51536),closed,2025-07-15 15:45:11+00:00,2025-07-16 16:32:35+00:00,1,1,1
3232666176,61864,DOC: make doc build run with string dtype enabled,closed,2025-07-15 15:09:32+00:00,2025-07-17 08:31:08+00:00,1,1,1
3232435167,61863,BUG: describe(include=..) fails with unrelated error if provided data types are not present,closed,2025-07-15 14:09:59+00:00,2025-10-05 22:22:27+00:00,3,82,1
3232408118,61862,BUG: DateOffset default temporal pattern does not work as expected with DST,closed,2025-07-15 14:02:55+00:00,2026-03-26 03:09:39+00:00,0,253,1
3231339659,61861,BUG: pd.eval raises AttributeError: 'BinOp' object has no attribute 'value',closed,2025-07-15 08:32:29+00:00,2025-07-15 08:47:03+00:00,1,0,1
3231184894,61860,"ENH: New method ""ends"" as a combination of “head” and ""tail""",closed,2025-07-15 07:43:12+00:00,2025-08-05 16:28:53+00:00,3,21,1
3230907178,61859,Doc simplify footer,closed,2025-07-15 06:04:19+00:00,2025-07-28 17:24:56+00:00,1,13,1
3230132228,61858,Upgraded README.md,closed,2025-07-14 21:50:23+00:00,2025-07-14 23:53:48+00:00,1,0,1
3229553781,61857,CI: Add testing for Window ARM,closed,2025-07-14 17:52:47+00:00,2025-07-14 17:58:22+00:00,1,0,1
3229434913,61855,"BUG: If both index and axis are passed to DataFrame.drop, raise a clear error",closed,2025-07-14 17:08:35+00:00,2025-07-18 02:18:16+00:00,5,3,1
3228706921,61854,BUG: Reassigning .rolling().mean() returns NaNs (pandas-dev#61841),closed,2025-07-14 13:03:22+00:00,2025-07-14 13:07:11+00:00,0,0,1
3228508450,61853,fix extension type check for ArrowDtype,closed,2025-07-14 11:58:50+00:00,2025-07-14 11:59:51+00:00,0,0,1
3227554421,61852,BUG: Fix .rolling().mean() reassignment returning NaNs (pandas-dev#61841),closed,2025-07-14 06:39:11+00:00,2025-07-25 17:57:46+00:00,0,11,1
3227483722,61851,BUG: Fix .rolling().mean() reassignment returning NaNs (pandas-dev#61841),closed,2025-07-14 06:08:20+00:00,2025-07-14 16:39:17+00:00,1,0,1
3227448573,61850,BUG: Fix issue #61841 - .rolling().mean() returns NaNs on reassignment,closed,2025-07-14 05:50:42+00:00,2025-07-14 05:54:19+00:00,0,0,1
3227120464,61849,Remove incorrect line in Series init docstring,closed,2025-07-14 02:01:35+00:00,2025-07-14 15:48:25+00:00,1,0,1
3227118813,61848,DOC: Series.__init__ doc incorrectly says dtype is ignored if data is a Series,closed,2025-07-14 02:00:43+00:00,2025-07-14 15:48:26+00:00,0,0,1
3226691653,61847,BUG: Fix .rolling().mean() returning NaNs on reassignment (#61841),closed,2025-07-13 17:48:15+00:00,2025-07-13 18:31:45+00:00,0,0,1
3226644773,61846,BUG: Fix .rolling().mean() returning NaNs on reassignment (#61841),closed,2025-07-13 16:39:51+00:00,2025-07-13 17:45:12+00:00,0,0,1
3226557213,61845,BUG: Fix rolling().mean() returning NaNs on reassignment (#61841),closed,2025-07-13 14:42:18+00:00,2025-07-14 16:39:10+00:00,1,1,1
3226437589,61844,ENH: Backport free-threading support to 2.3,closed,2025-07-13 11:45:27+00:00,2026-03-18 00:34:09+00:00,3,247,1
3226430650,61843,DOC: Simplify pandas theme footer,closed,2025-07-13 11:34:18+00:00,2025-07-14 16:37:15+00:00,2,1,1
3226180052,61842,Create Vix,closed,2025-07-13 06:20:40+00:00,2025-07-14 15:46:56+00:00,1,1,1
3225929050,61841,"BUG: .rolling().mean() returns all NaNs on re-execution, despite .copy() use",closed,2025-07-12 23:36:26+00:00,2025-09-24 17:00:02+00:00,6,73,1
3225401662,61840,DOC: Add unified code guideline document (#33851),closed,2025-07-12 14:07:15+00:00,2025-07-12 18:33:51+00:00,3,0,1
3225093081,61839,DOC: rm excessive backtick,closed,2025-07-12 09:16:13+00:00,2025-07-12 18:36:28+00:00,1,0,1
3224729529,61837,BUG: read_csv() on_bad_lines callable does not raise ParserWarning when index_col is set,closed,2025-07-12 03:01:11+00:00,2025-09-29 20:40:08+00:00,2,79,1
3224725538,61836,DOC: Update README.md to reference issues related to 'good first issue' and 'Docs' properly,closed,2025-07-12 02:55:59+00:00,2025-07-12 18:49:35+00:00,1,0,1
3224725304,61835,DOC: README.md link for issues specified for Docs and good first issue doesn't reference properly,closed,2025-07-12 02:55:35+00:00,2025-07-12 18:49:36+00:00,1,0,1
3224532712,61834,ENH: error message context.,closed,2025-07-12 00:11:06+00:00,2026-03-07 21:14:20+00:00,2,238,1
3223459674,61833,DOC: Clarify str.cat output for Index object (GH35556),closed,2025-07-11 16:10:36+00:00,2025-07-28 17:23:17+00:00,1,17,1
3223192067,61832,REF: separate out helpers in libparser,closed,2025-07-11 14:51:21+00:00,2025-07-11 16:32:39+00:00,1,0,1
3222315548,61831,BUG: Intersection of Pandas Index Object is not working properly,closed,2025-07-11 09:57:14+00:00,2025-07-11 15:41:22+00:00,1,0,1
3221370251,61830,TST: Fix `test_mask_stringdtype` ,closed,2025-07-11 03:33:52+00:00,2025-07-11 16:35:45+00:00,1,0,1
3221165163,61829,ENH: Add a function like PYQT signal,closed,2025-07-11 01:25:12+00:00,2025-08-05 16:19:10+00:00,4,25,1
3220921101,61828,BUG: Dataframe arithmatic operators don't work with Series using fill_value,closed,2025-07-10 22:54:01+00:00,2026-03-31 23:26:10+00:00,31,264,1
3220718791,61827,DOC: Correct error message in AbstractMethodError for methodtype argument,closed,2025-07-10 21:10:11+00:00,2025-07-11 22:50:19+00:00,3,1,1
3220114056,61826,"TST: enable 2D tests for MaskedArrays, fix+test shift",closed,2025-07-10 17:21:01+00:00,2025-07-11 16:41:58+00:00,1,0,1
3219990761,61825,PERF: Brainstorming read_csv perf improvements,closed,2025-07-10 16:32:15+00:00,2026-04-18 23:11:35+00:00,3,282,1
3219391518,61824,BUG: `mask` in `test_mask_stringdtype` would always return the same result regardless of `cond`,closed,2025-07-10 13:32:51+00:00,2025-07-11 16:35:47+00:00,1,1,1
3218613276,61823,BUG: drop doesn't recognise MultiIndexes,closed,2025-07-10 09:39:27+00:00,2025-07-18 02:18:17+00:00,7,7,1
3218091232,61822,TST: Adding tests for validating  DataFrame.__setitem__ and .loc behavior,closed,2025-07-10 06:33:10+00:00,2025-08-01 05:32:38+00:00,3,21,1
3217521002,61821,DOC: Update link to pytz documentation,closed,2025-07-10 00:46:51+00:00,2025-07-11 16:21:30+00:00,2,1,1
3216771450,61820,DOC: Clarify broadcasting behavior when using lists in DataFrame arithmetic (GH18857),closed,2025-07-09 18:21:25+00:00,2025-10-05 22:50:41+00:00,2,88,1
3215487867,61818,Improved installation instruction in docs for clarity,closed,2025-07-09 10:51:03+00:00,2025-07-09 14:37:34+00:00,1,0,1
3214392590,61817,"To develop a machine learning model that accurately predicts house prices based on 
various features such as location, size, number of bedrooms, and other relevant factors.",closed,2025-07-09 03:51:38+00:00,2025-07-09 16:03:02+00:00,1,0,1
3214346286,61816,BUG: DataFrame.aggregate to preserve extension dtypes with callable functions,closed,2025-07-09 03:15:42+00:00,2025-10-05 21:25:11+00:00,5,88,1
3213602334,61815,DOC: Add Raises section to pd.to_numeric docstring,closed,2025-07-08 19:44:19+00:00,2025-07-16 16:30:29+00:00,1,7,1
3213566302,61814,CI: Remove PyPy references in CI testing,closed,2025-07-08 19:27:53+00:00,2025-07-09 21:47:42+00:00,1,1,1
3211617510,61811,DOC: Lacking information on error type raised by pd.to_numeric,closed,2025-07-08 08:46:42+00:00,2025-07-16 16:29:48+00:00,1,8,1
3211492270,61810,DOC: update release process maintainer guide,closed,2025-07-08 08:06:45+00:00,2025-07-22 09:34:20+00:00,2,14,1
3210844817,61809,BUG: Pandas Series with Xarray slow print time.,closed,2025-07-08 02:57:42+00:00,2026-03-17 20:50:36+00:00,1,252,1
3210425973,61808,CLN: remove doctest-ignores,closed,2025-07-07 22:39:49+00:00,2025-07-08 15:01:48+00:00,0,0,1
3210131899,61806,DEPS: Bump NumPy and tzdata,closed,2025-07-07 20:11:43+00:00,2025-07-08 15:44:42+00:00,0,0,1
3209849864,61805,DOC: Improve clarity of GroupBy introduction sentence,closed,2025-07-07 18:03:11+00:00,2025-07-15 22:25:12+00:00,1,8,1
3209770110,61804,DOC: Improve documentation for DataFrame.__setitem__ and .loc assignment from Series,closed,2025-07-07 17:27:16+00:00,2025-08-01 15:31:04+00:00,4,24,1
3209648127,61803,Backport PR #61794 on branch 2.3.x (DOC: prepare 2.3.1 whatsnew notes for release),closed,2025-07-07 16:36:39+00:00,2025-07-07 17:09:22+00:00,0,0,1
3209627593,61802,[pre-commit.ci] pre-commit autoupdate,closed,2025-07-07 16:30:08+00:00,2025-07-07 18:09:15+00:00,0,0,1
3209113779,61801,[backport 2.3.x] TST: update expected dtype for sum of decimals with pyarrow 21+ (#61799),closed,2025-07-07 13:46:21+00:00,2025-07-07 14:56:23+00:00,0,0,1
3209017025,61800,[backport 2.3.x] BUG[string]: incorrect index downcast in DataFrame.join (#61771),closed,2025-07-07 13:19:28+00:00,2025-07-07 15:40:37+00:00,0,0,1
3208910996,61799,TST: update expected dtype for sum of decimals with pyarrow 21+,closed,2025-07-07 12:50:39+00:00,2025-07-07 13:41:24+00:00,3,0,1
3208792361,61798,"Backport PR #61795 on branch 2.3.x (DOC: add section about upcoming pandas 3.0 changes (string dtype, CoW) to 2.3 whatsnew notes)",closed,2025-07-07 12:16:00+00:00,2025-07-07 13:25:28+00:00,0,0,1
3208572203,61797,Backport PR #61705 on branch 2.3.x (DOC: add pandas 3.0 migration guide for the string dtype),closed,2025-07-07 11:09:03+00:00,2025-07-07 11:37:30+00:00,0,0,1
3208491765,61796,Bump pypa/cibuildwheel from 2.23.3 to 3.0.1,closed,2025-07-07 10:46:14+00:00,2025-07-28 12:59:29+00:00,1,21,1
3208273381,61795,"DOC: add section about upcoming pandas 3.0 changes (string dtype, CoW) to 2.3 whatsnew notes",closed,2025-07-07 09:43:16+00:00,2025-07-07 12:15:54+00:00,7,0,1
3208152643,61794,DOC: prepare 2.3.1 whatsnew notes for release,closed,2025-07-07 09:03:14+00:00,2025-07-07 16:36:05+00:00,9,0,1
3207901022,61793,Backport PR #61770 on branch 2.3.x (BUG: Fix unpickling of string dtypes of legacy pandas versions),closed,2025-07-07 07:41:47+00:00,2025-07-07 13:14:39+00:00,1,0,1
3207827049,61792,TST: assert reading of legacy pickles against current data,closed,2025-07-07 07:15:47+00:00,2026-01-21 13:06:10+00:00,3,198,1
3207503620,61791,DOC: Improve text color in dark mode for tutorial navigation buttons,closed,2025-07-07 04:28:05+00:00,2025-07-07 13:15:53+00:00,3,0,1
3207074435,61790,DOC: Add link to WebGL in pandas ecosystem,closed,2025-07-06 21:57:00+00:00,2025-07-07 16:21:14+00:00,1,0,1
3206317537,61789,CLN: remove and udpate for outdated _item_cache,closed,2025-07-06 09:01:28+00:00,2025-07-07 16:29:16+00:00,1,1,1
3205751577,61788,"BUG: read_excel() converts the string ""None"" in an Excel file to ""NaN""",closed,2025-07-05 22:56:52+00:00,2025-07-08 22:06:33+00:00,6,2,1
3205656770,61787,DOCS: Add detailed Windows build instructions,closed,2025-07-05 21:33:33+00:00,2025-07-05 21:33:47+00:00,0,0,1
3205636284,61786,PERF: avoid object-dtype path in ArrowEA._explode,closed,2025-07-05 21:19:41+00:00,2025-07-07 16:39:58+00:00,1,1,1
3205623246,61785,"REF: remove unreachable, stronger typing in parsers.pyx",closed,2025-07-05 21:08:44+00:00,2025-07-07 17:09:59+00:00,1,1,1
3205501535,61784,ENH: Add Coefficient of Variation to DataFrame.describe(),closed,2025-07-05 19:51:00+00:00,2025-07-07 21:26:48+00:00,4,2,1
3205193985,61783,PERF: Unnecessary string interning in read_csv?,closed,2025-07-05 16:26:49+00:00,2025-07-08 14:52:42+00:00,2,2,1
3203070509,61780,BUG: tz_localize(None) with Arrow timestamp,closed,2025-07-04 15:08:39+00:00,2025-08-11 16:29:29+00:00,1,38,1
3203022783,61779,TST: option_context bug on Mac GH#58055,closed,2025-07-04 14:50:58+00:00,2025-07-07 16:42:39+00:00,1,3,1
3202114847,61778,"BUG?: creating Categorical from pandas Index/Series with ""object"" dtype infers string",closed,2025-07-04 10:15:04+00:00,2025-10-24 17:13:26+00:00,4,112,1
3201065687,61776,Request For Help: unexplained ArrowInvalid overflow,closed,2025-07-04 02:04:25+00:00,2025-07-04 14:10:31+00:00,5,0,1
3201008776,61775,API/BUG: different constructor behavior for numpy vs pyarrow dt64tzs,closed,2025-07-04 01:16:30+00:00,2025-07-07 16:54:31+00:00,1,3,1
3200840173,61774,CI: Add NumPy 1.26 test job,closed,2025-07-03 22:53:51+00:00,2025-07-08 10:19:37+00:00,1,4,1
3200833112,61773,BUG: Decimal(NaN) incorrectly allowed in ArrowEA constructor with tim…,closed,2025-07-03 22:48:01+00:00,2025-07-07 16:54:30+00:00,2,3,1
3200714976,61771,BUG[string]: incorrect index downcast in DataFrame.join,closed,2025-07-03 21:38:28+00:00,2025-07-07 13:15:03+00:00,3,3,1
3200572306,61770,BUG: Fix unpickling of string dtypes of legacy pandas versions,closed,2025-07-03 20:35:31+00:00,2025-07-07 07:41:22+00:00,1,3,1
3200479757,61769,Improve MultiIndex label rename checks,closed,2025-07-03 19:50:23+00:00,2025-10-05 22:44:49+00:00,2,94,1
3200138340,61768,"BUG: NA.__and__, __or__, __xor__ with np.bool_ objects",closed,2025-07-03 17:38:42+00:00,2025-07-03 22:49:57+00:00,1,0,1
3200054572,61767,"Revert ""ENH: Allow third-party packages to register IO engines""",closed,2025-07-03 17:07:31+00:00,2025-07-03 17:07:39+00:00,0,0,1
3198875537,61766,BUG: ensure to_numeric down-casts to uint64 for large unsigned integers,closed,2025-07-03 10:24:24+00:00,2025-07-28 17:21:36+00:00,1,25,1
3198775065,61765,chore: testing,closed,2025-07-03 09:50:20+00:00,2025-07-03 09:52:02+00:00,0,0,1
