id,number,title,state,created_at,closed_at,comments,close_duration_days,is_closed
4018612782,64387,BUG: fix sort_index with level keyword on single-level RangeIndex,closed,2026-03-03 20:41:54+00:00,2026-03-09 12:11:33+00:00,1,5,1
4018583852,64386,BUG: fix sort_index AssertionError with RangeIndex and level parameter,closed,2026-03-03 20:34:36+00:00,2026-03-26 16:51:05+00:00,3,22,1
4018321044,64385,TST: atol=1e-15 for flaky plotting tests,closed,2026-03-03 19:23:43+00:00,2026-03-03 20:06:19+00:00,1,0,1
4017996206,64384,Backport PR #64375: BUG: Fix docstrings and assignments for NumPy 2.4.0 compatibility,closed,2026-03-03 17:56:54+00:00,2026-03-03 19:35:36+00:00,0,0,1
4016615667,64383,BUG: DataFrame.sort_index does fails with `AssertionError`,closed,2026-03-03 13:14:42+00:00,2026-03-26 16:51:07+00:00,4,23,1
4015996661,64382,DOC: Fix ES01 for pandas.io.formats.style.Styler,closed,2026-03-03 10:51:29+00:00,2026-03-03 17:42:50+00:00,1,0,1
4015837071,64381,DOC: Typo in Cheatsheet regarding df.dtypes,closed,2026-03-03 10:14:05+00:00,2026-03-09 16:57:28+00:00,3,6,1
4015433327,64380,DOC: Fix ES01 for pandas.IntervalIndex,closed,2026-03-03 08:43:34+00:00,2026-03-03 17:42:19+00:00,1,0,1
4015369336,64379,PERF: improve performance with ZoneInfo timezones (get internal transitions/deltas to avoid slow python path),closed,2026-03-03 08:25:53+00:00,2026-05-06 08:45:11+00:00,17,64,1
4015267367,64378,DOC: Fix ES01 for pandas.api.types,closed,2026-03-03 07:56:17+00:00,2026-03-03 17:43:22+00:00,1,0,1
4015105383,64377,PERF: Speed up DatetimeIndex field accessors with ZoneInfo timezones,closed,2026-03-03 07:09:40+00:00,2026-03-18 21:54:33+00:00,2,15,1
4014965566,64376,PERF: fix slow DatetimeIndex plotting for multiplied frequencies,closed,2026-03-03 06:28:14+00:00,2026-03-23 00:04:56+00:00,4,19,1
4013990191,64375,BUG: Fix docstrings and assignments for NumPy 2.4.0 compatibility,closed,2026-03-03 00:13:55+00:00,2026-03-03 03:15:04+00:00,2,0,1
4013891964,64374,PERF: pprint_thing,closed,2026-03-02 23:38:00+00:00,2026-03-04 18:41:02+00:00,1,1,1
4012921380,64373,Backport PR #64361 on branch 3.0.x (Bump actions/upload-artifact from 6 to 7),closed,2026-03-02 19:32:13+00:00,2026-03-02 19:51:14+00:00,0,0,1
4012920397,64372,Backport PR #64360 on branch 3.0.x (Bump actions/download-artifact from 7 to 8),closed,2026-03-02 19:31:58+00:00,2026-03-02 19:50:59+00:00,0,0,1
4012856477,64371,"PERF: fix pprint_thing performance regression from ABC isinstance checks (GH#58285, GH#57641)",closed,2026-03-02 19:15:35+00:00,2026-03-02 21:09:15+00:00,1,0,1
4012513580,64370,PERF: left join fastpath,closed,2026-03-02 17:48:08+00:00,2026-03-02 21:40:08+00:00,2,0,1
4012475544,64369,DOC: Fix ES01 for pandas.testing,closed,2026-03-02 17:39:01+00:00,2026-03-03 17:41:34+00:00,1,1,1
4012427525,64368,Backport PR #64367 on branch 3.0.x ([pre-commit.ci] pre-commit autoupdate),closed,2026-03-02 17:29:01+00:00,2026-03-02 19:27:25+00:00,0,0,1
4012144680,64367,[pre-commit.ci] pre-commit autoupdate,closed,2026-03-02 16:31:46+00:00,2026-03-02 17:28:32+00:00,0,0,1
4011950422,64366,BUG: combine all implementations of kurtosis and skewness computations and align results with SciPy,closed,2026-03-02 15:48:19+00:00,2026-03-13 20:32:53+00:00,13,11,1
4011537835,64365,TST: Use EA scalar instead of python scalar in `test_compare_scalar`,closed,2026-03-02 14:19:44+00:00,2026-03-11 14:41:57+00:00,2,9,1
4011495977,64364,BUG: pd.array now rejects multidimensional arguments,closed,2026-03-02 14:10:34+00:00,2026-03-02 14:59:35+00:00,1,0,1
4011311120,64363,PERF: datetime index getters functions are 10 times slower with ZoneInfo vs pytz timezone,closed,2026-03-02 13:34:04+00:00,2026-05-06 08:45:13+00:00,10,64,1
4010011743,64362,DOC: Fix ES01 for pandas.DataFrame,closed,2026-03-02 08:38:33+00:00,2026-03-02 17:24:33+00:00,1,0,1
4009973995,64361,Bump actions/upload-artifact from 6 to 7,closed,2026-03-02 08:29:13+00:00,2026-03-02 19:32:06+00:00,0,0,1
4009973499,64360,Bump actions/download-artifact from 7 to 8,closed,2026-03-02 08:29:06+00:00,2026-03-02 19:31:50+00:00,0,0,1
4008184826,64359,PERF: use pc.utf8_normalize,closed,2026-03-01 20:19:41+00:00,2026-03-02 17:29:04+00:00,1,0,1
4008116162,64358,BUG: Fix DatetimeIndex.intersection returning wrong results for non-normalized frequencies,closed,2026-03-01 19:44:21+00:00,2026-03-01 20:01:32+00:00,1,0,1
4008047944,64357,BUG: fix 1-ULP rounding error in precise_xstrtod via uint64_t mantissa accumulation,closed,2026-03-01 19:12:48+00:00,2026-03-02 19:40:54+00:00,1,1,1
4008036282,64356,PERF: floatify,closed,2026-03-01 19:07:54+00:00,2026-03-02 14:29:34+00:00,1,0,1
4007691501,64355,DOC: Fix typo in tz_localize level parameter description,closed,2026-03-01 16:44:46+00:00,2026-03-01 17:54:10+00:00,1,0,1
4007493987,64354,DOC: Replace pig with deer in Series.to_markdown docstring example,closed,2026-03-01 15:26:18+00:00,2026-03-01 17:30:59+00:00,2,0,1
4007487517,64353,DOC: Use more representative food items in MultiIndex query example,closed,2026-03-01 15:23:12+00:00,2026-03-01 17:31:26+00:00,2,0,1
4006275462,64352,DOC: Fix ES01 for pandas.api.typing.Rolling,closed,2026-03-01 05:00:57+00:00,2026-03-01 17:35:57+00:00,1,0,1
4006223815,64351,DOC: Fix ES01 for pandas.Interval,closed,2026-03-01 04:18:39+00:00,2026-03-01 17:34:38+00:00,1,0,1
4005353183,64349,BUG: large memory allocation when attempting to convert an int/float dict of arrays into dataframe,closed,2026-02-28 20:40:33+00:00,2026-03-03 15:02:40+00:00,6,2,1
4005311881,64348,TYP: pytables,closed,2026-02-28 20:20:11+00:00,2026-03-01 17:33:17+00:00,1,0,1
4004137848,64346,DOC: use correct version for stable source links in docs,closed,2026-02-28 07:37:58+00:00,2026-03-06 17:05:07+00:00,1,6,1
4003704747,64344,BUG: fix read_sas large datetimes off by 2 days (GH#56014),closed,2026-02-28 02:50:23+00:00,2026-03-02 19:56:49+00:00,1,2,1
4002837326,64343,BUG: Fix MultiIndex partial-key lookup when np.datetime64 indexes datetime.date level (GH#55969),closed,2026-02-27 20:57:45+00:00,2026-03-22 20:51:07+00:00,2,22,1
4002313823,64341,BUG: Fix assert_frame_equal with check_dtype=False for pd.NA GH#61473,closed,2026-02-27 18:30:07+00:00,2026-05-29 02:16:49+00:00,3,90,1
4001926912,64340,DOC: Fix ES01 for pandas.Index,closed,2026-02-27 16:49:55+00:00,2026-02-28 17:01:49+00:00,1,1,1
4001610801,64339,BUG: Assigning pd.NA to StringDtype column causes data corruption and pyarrow error,closed,2026-02-27 15:35:40+00:00,2026-03-11 10:12:33+00:00,2,11,1
4001350132,64338,Backport PR #64318 on branch 3.0.x (BUG: HDFStore.select(where=...) silently returns empty DataFrame with datetime64[us] index),closed,2026-02-27 14:40:39+00:00,2026-02-27 18:12:31+00:00,0,0,1
4000278664,64336,DOC: clarify Series.case_when condition-order semantics,closed,2026-02-27 10:21:04+00:00,2026-04-04 21:09:39+00:00,3,36,1
4000247020,64335,DOC: explain read_csv/read_table float_precision behavior,closed,2026-02-27 10:13:12+00:00,2026-03-28 19:51:25+00:00,1,29,1
4000035165,64334,DOC: clarify Index.union behavior with duplicates,closed,2026-02-27 09:21:45+00:00,2026-03-23 22:23:22+00:00,3,24,1
3999329118,64332,"BUG: Regression with interpolate: ""ValueError: window shape cannot be larger than input array shape""",closed,2026-02-27 06:15:38+00:00,2026-03-06 14:31:49+00:00,1,7,1
3998679242,64331,TST: regression test for HDFStore.select with non-sorted Categorical (GH#38131),closed,2026-02-27 02:19:38+00:00,2026-03-31 23:35:46+00:00,6,32,1
3998238657,64330,PERF: use kth_smallest_c (O(n) quickselect) in group_quantile,closed,2026-02-26 23:16:30+00:00,2026-02-27 00:21:31+00:00,2,0,1
3998044741,64329,TYP: EllipsisType,closed,2026-02-26 22:20:51+00:00,2026-02-26 23:34:13+00:00,0,0,1
3997999449,64328,TST: fix xfailed plotting tests,closed,2026-02-26 22:08:31+00:00,2026-02-26 23:13:11+00:00,1,0,1
3997507612,64326,BUG: Fix df.query('abs(col) == [...]') membership rewrite (#31848),closed,2026-02-26 20:05:28+00:00,2026-02-26 20:12:37+00:00,0,0,1
3997320016,64325,TYP: bump mypy to 1.19.1,closed,2026-02-26 19:19:28+00:00,2026-03-01 18:43:05+00:00,6,2,1
3996766519,64324,DOC: Fix ES01 for pandas.Timedelta,closed,2026-02-26 17:16:53+00:00,2026-02-27 16:47:24+00:00,1,0,1
3995912302,64322,"BUG: Regression with interpolate: ""ValueError: window shape cannot be larger than input array shape""",closed,2026-02-26 14:31:28+00:00,2026-03-06 14:31:52+00:00,1,8,1
3995658696,64321,DOC: clarify list-like conversion in DataFrame broadcasting behavior,closed,2026-02-26 13:42:17+00:00,2026-04-25 02:50:13+00:00,7,57,1
3994827058,64320,"BUG: Assigning pd.NA to StringDtype column causes ""Unknown error: Wrapping .. failed"" after pd.concat with PyArrow",closed,2026-02-26 11:00:23+00:00,2026-03-11 10:12:34+00:00,4,12,1
3993708052,64319,DOC: clarify .loc Series-assignment alignment behavior,closed,2026-02-26 07:06:40+00:00,2026-04-04 21:16:06+00:00,2,37,1
3993435135,64318,BUG: HDFStore.select(where=...) silently returns empty DataFrame with datetime64[us] index,closed,2026-02-26 05:47:48+00:00,2026-02-27 14:40:09+00:00,0,1,1
3992923118,64317,TST: troubleshoot flaky linux plotting tests,closed,2026-02-26 02:41:02+00:00,2026-03-02 19:42:17+00:00,2,4,1
3992908338,64316,TST: remove strict=False xfail from plotting test,closed,2026-02-26 02:34:40+00:00,2026-02-26 16:29:13+00:00,1,0,1
3992783613,64315,Test Issue from API,closed,2026-02-26 01:52:02+00:00,2026-02-26 12:36:20+00:00,2,0,1
3992777569,64314,Test Issue from API,closed,2026-02-26 01:50:10+00:00,2026-02-26 12:34:09+00:00,0,0,1
3992776411,64313,Test Issue from API,closed,2026-02-26 01:49:47+00:00,2026-02-26 12:34:01+00:00,0,0,1
3992775555,64312,Test Issue from API,closed,2026-02-26 01:49:30+00:00,2026-02-26 12:33:54+00:00,0,0,1
3992415546,64311,REF: avoid Period[B] in plotting,closed,2026-02-25 23:43:13+00:00,2026-02-26 16:28:20+00:00,1,0,1
3991602903,64310,BUG: HDFStore.select(where=...) silently returns empty DataFrame with datetime64[us] index,closed,2026-02-25 20:24:11+00:00,2026-02-27 14:40:10+00:00,1,1,1
3990620839,64309,DOC: Fix ES01 for pandas.Timestamp,closed,2026-02-25 17:04:11+00:00,2026-02-25 18:22:48+00:00,1,0,1
3988942583,64306,BUG: Handle Day offset in to_timedelta ,closed,2026-02-25 11:37:48+00:00,2026-03-28 17:31:20+00:00,7,31,1
3988182855,64305,Pandas,closed,2026-02-25 09:14:29+00:00,2026-02-25 09:15:03+00:00,0,0,1
3987698017,64304,PERF: DataFrame.describe() calls Series.reindex() N times instead of once,closed,2026-02-25 07:24:49+00:00,2026-02-25 21:48:05+00:00,1,0,1
3987691340,64303,PERF: DataFrame.describe() calls Series.reindex() N times instead of once,closed,2026-02-25 07:22:50+00:00,2026-02-25 21:48:06+00:00,0,0,1
3985714256,64301,Fix a minor doc typo in DataFrame.convert_dtypes,closed,2026-02-24 20:38:44+00:00,2026-02-24 21:24:52+00:00,1,0,1
3985217149,64299,CI: `validate_docstrings.py` breaks in WSL,closed,2026-02-24 18:33:18+00:00,2026-02-26 02:15:51+00:00,1,1,1
3984866124,64296,TST: Add regression test for GH#55969 datetime.date MultiIndex with np.datetime64,closed,2026-02-24 17:13:51+00:00,2026-03-22 20:50:47+00:00,1,26,1
3982639828,64295,DOC: Fix ES01 for pandas.Series,closed,2026-02-24 09:53:04+00:00,2026-02-24 21:39:44+00:00,1,0,1
3981952783,64294,TST: mark test_dt64arr_cmp_arraylike_invalid[tzlocal] xfail on Windows,closed,2026-02-24 07:04:55+00:00,2026-04-11 17:00:42+00:00,5,46,1
3981617468,64293,ENH: Implement stable parameter behavior in Series.argsort,closed,2026-02-24 05:31:12+00:00,2026-02-25 04:51:08+00:00,0,0,1
3981567504,64292,BUG: Suppress unnecessary RuntimeWarning in to_datetime with missing componentsFix runtime warning,closed,2026-02-24 05:14:22+00:00,2026-03-06 22:11:09+00:00,6,10,1
3981474145,64291,DOC/BLD: fix wrong (empty) version in dev docs,closed,2026-02-24 04:39:30+00:00,2026-03-31 11:20:48+00:00,9,35,1
3980647092,64290,DOC: add section on DataFrame + list broadcasting behavior,closed,2026-02-23 23:28:25+00:00,2026-04-25 02:49:46+00:00,3,60,1
3980630339,64289,GH#57702: Fix inconsistent None handling in pd.array with string dtype,closed,2026-02-23 23:23:47+00:00,2026-04-10 17:24:12+00:00,2,45,1
3979765797,64288,BUG: Fix dtype inference for tz-aware datetime in .loc assignment,closed,2026-02-23 19:21:02+00:00,2026-02-23 21:54:16+00:00,1,0,1
3979403494,64287,Backport PR #64270 on branch 3.0.x (BUG: Support for Expressions with dunders),closed,2026-02-23 17:48:12+00:00,2026-02-23 18:33:25+00:00,0,0,1
3979241948,64286,TST: Add regression test for GH#55423 tz-aware datetime expansion,closed,2026-02-23 17:09:59+00:00,2026-03-22 19:55:28+00:00,1,27,1
3977863050,64284,ENH: Implement stable parameter behavior in Series.argsort (GH#64255),closed,2026-02-23 12:11:20+00:00,2026-02-24 04:45:05+00:00,0,0,1
3977819550,64283,feat: add Series.str.splitlines and Series.str.expandtabs,closed,2026-02-23 12:00:36+00:00,2026-04-17 15:13:06+00:00,4,53,1
3976975447,64281,BUG: test_dt64arr_cmp_arraylike_invalid[tzlocal] fails on Windows,closed,2026-02-23 08:35:59+00:00,2026-05-25 12:44:55+00:00,3,91,1
3975677770,64279,CI: Simplify wheel workflow,closed,2026-02-22 23:30:44+00:00,2026-03-24 17:46:12+00:00,1,29,1
3975223383,64278,TST: add test for GH#55423 loc setitem preserving tz-aware datetime,closed,2026-02-22 19:00:13+00:00,2026-03-23 08:47:34+00:00,0,28,1
3975164924,64277,TST: add regression test for GH #42437,closed,2026-02-22 18:21:15+00:00,2026-03-21 16:09:54+00:00,2,26,1
3975123611,64276,BUG: Suppress unnecessary RuntimeWarning in to_datetime with missing componentsFix runtime warning,closed,2026-02-22 17:56:13+00:00,2026-02-24 04:46:17+00:00,0,1,1
3974940600,64275,BUILD: generate_version.py line ending breaks build (WSL),closed,2026-02-22 16:19:50+00:00,2026-05-13 23:27:44+00:00,1,80,1
3974248778,64274,DOC: clarify Series reindexing on column assignment,closed,2026-02-22 11:18:11+00:00,2026-04-04 21:12:04+00:00,1,41,1
3973986665,64273,BUG: The order of items in pd.concat matters for the resulting .index.freq,closed,2026-02-22 09:09:04+00:00,2026-05-13 23:27:32+00:00,1,80,1
3973190331,64271,BUG: `generate_version.py` line ending breaks build (WSL),closed,2026-02-22 00:56:05+00:00,2026-02-22 00:57:59+00:00,0,0,1
3972915169,64270,BUG: Support for Expressions with dunders,closed,2026-02-21 22:00:25+00:00,2026-02-23 17:47:43+00:00,1,1,1
3972623529,64269,TST: Add regression test for DatetimeIndex.equals coercion (GH#13286),closed,2026-02-21 19:40:19+00:00,2026-03-17 20:26:22+00:00,3,24,1
3972604589,64268,DOC: Fix ES01 for pandas.DataFrame,closed,2026-02-21 19:28:22+00:00,2026-02-23 17:38:50+00:00,1,1,1
3972565735,64267,BUG: Error message when using pd.col() and power operator ** in new expression syntax,closed,2026-02-21 19:06:04+00:00,2026-02-23 17:47:44+00:00,1,1,1
3972478655,64264,ENH: Investigate when we return NumPy scalars,closed,2026-02-21 18:18:31+00:00,2026-02-21 18:48:39+00:00,0,0,1
3972213337,64263,Suggestion: link a RAG / LLM debugging checklist (WFGY Problem Map) in the docs,closed,2026-02-21 15:25:23+00:00,2026-02-21 21:37:07+00:00,2,0,1
3971765094,64262,DOC: Fix ES01 for pandas.Index,closed,2026-02-21 09:56:19+00:00,2026-02-21 18:13:27+00:00,1,0,1
3971462021,64261,DOC: Fix ES01 for pandas.api.types,closed,2026-02-21 06:33:08+00:00,2026-02-21 18:12:56+00:00,1,0,1
3971436951,64260,DOC: Fix ES01 for pandas.Timestamp,closed,2026-02-21 06:19:14+00:00,2026-02-23 17:48:22+00:00,1,2,1
3971385688,64259,DOC: Fix ES01 for pandas.Series,closed,2026-02-21 05:49:37+00:00,2026-02-21 18:12:15+00:00,1,0,1
3970994662,64258,PERF: PeriodArray._from_sequence,closed,2026-02-21 01:33:33+00:00,2026-02-23 17:50:20+00:00,1,2,1
3970455277,64257,PERF: Period.__repr__,closed,2026-02-20 21:30:19+00:00,2026-02-20 22:20:52+00:00,1,0,1
3969795574,64256,REF: period_array use dtype instead of freq,closed,2026-02-20 18:20:17+00:00,2026-02-20 22:22:18+00:00,1,0,1
3969604459,64254,DOC: Fix source link to use main branch (#64224),closed,2026-02-20 17:30:57+00:00,2026-03-06 16:57:56+00:00,2,13,1
3967135679,64251,PERF: avoid materializing values[indexer] in Block.setitem,closed,2026-02-20 07:55:13+00:00,2026-04-10 15:27:39+00:00,5,49,1
3967079315,64250,PERF: object-dtype iloc setitem with datetimelike list-like indexers is slow on large arrays,closed,2026-02-20 07:36:39+00:00,2026-04-10 15:27:41+00:00,1,49,1
3967050501,64249,PERF: object-dtype iloc setitem with datetimelike list-like indexers is slow on large arrays,closed,2026-02-20 07:26:48+00:00,2026-02-20 07:33:09+00:00,3,0,1
3966889090,64248,DOC: Fix ES01 for pandas methods,closed,2026-02-20 06:37:08+00:00,2026-02-20 16:52:28+00:00,1,0,1
3966826649,64247,DOC: Fix ES01 for pandas.Timestamp,closed,2026-02-20 06:21:12+00:00,2026-02-20 16:51:45+00:00,1,0,1
3966804468,64246,DOC: Fix ES01 for pandas.Series,closed,2026-02-20 06:14:35+00:00,2026-02-20 16:51:08+00:00,1,0,1
3965763658,64245,BUG: Consistent PeriodIndex/PeriodArray behavior with datetime64 data,closed,2026-02-20 00:02:53+00:00,2026-02-20 17:28:08+00:00,1,0,1
3964553836,64244,REF: avoid Period[B] usage in plotting,closed,2026-02-19 18:58:23+00:00,2026-02-21 00:38:37+00:00,2,1,1
3964428996,64243,Backport PR #64218 on branch 3.0.x (CI: Use scientific-python/upload-nightly-action for nightly wheels),closed,2026-02-19 18:33:38+00:00,2026-02-19 21:25:52+00:00,0,0,1
3964353321,64242,BUG: inconsistent PeriodArray/PeriodIndex construction casting behavior,closed,2026-02-19 18:17:40+00:00,2026-02-19 23:04:58+00:00,2,0,1
3963700933,64240,BUG: Inconsistent handling of offsets in `to_timedelta`,closed,2026-02-19 15:56:21+00:00,2026-03-28 17:31:22+00:00,3,37,1
3961290997,64236,DOC: Update documentation for apply function behavior,closed,2026-02-19 06:52:38+00:00,2026-04-11 11:42:58+00:00,2,51,1
3961139442,64235,BUG: normalize_json no longer supports top-level missing entries,closed,2026-02-19 05:59:30+00:00,2026-03-25 09:03:41+00:00,2,34,1
3960813711,64234,BUG: Wire skipna parameter through Period and Interval inference,closed,2026-02-19 03:30:45+00:00,2026-02-19 13:24:09+00:00,1,0,1
3960731020,64233,fix: bug posixpath inside Series,closed,2026-02-19 02:57:51+00:00,2026-04-09 22:16:47+00:00,12,49,1
3960225083,64232,Fix pr 64190 void guard,closed,2026-02-18 23:24:18+00:00,2026-02-18 23:33:32+00:00,0,0,1
3959998591,64231,ENH: support integers in PeriodArray._from_sequence,closed,2026-02-18 22:06:48+00:00,2026-02-19 18:38:35+00:00,3,0,1
3959337713,64230,PERF: avoid wasteful array round-trip in loc/iloc setitem with list-of-lists,closed,2026-02-18 19:03:32+00:00,2026-03-26 00:18:25+00:00,13,35,1
3959328614,64229,PERF: loc/iloc setitem with list-of-lists unnecessarily round-trips through object array,closed,2026-02-18 19:00:58+00:00,2026-03-26 00:18:27+00:00,1,35,1
3958978976,64228,Update _hypothesis.py,closed,2026-02-18 17:30:37+00:00,2026-02-18 18:49:51+00:00,1,0,1
3958416264,64226,Doc +link,closed,2026-02-18 15:29:33+00:00,2026-02-18 18:51:06+00:00,3,0,1
3958389907,64225,TST/DOC: document BDay no-weekend-gap behavior in plotting,closed,2026-02-18 15:24:27+00:00,2026-02-18 19:05:43+00:00,1,0,1
3958336137,64224,DOC: wrong source link for `pandas.DataFrame` because of __module__ changes,closed,2026-02-18 15:12:07+00:00,2026-04-30 08:39:19+00:00,11,70,1
3958286774,64223,DOC: source links not working: 404 on GitHub,closed,2026-02-18 15:01:12+00:00,2026-03-06 17:05:08+00:00,3,16,1
3958193220,64222,[backport 3.0.x] DOC: start 3.0.2 whatsnew notes (#64220),closed,2026-02-18 14:40:54+00:00,2026-02-18 15:37:53+00:00,0,0,1
3957968418,64221,chore: nanoseconds to microseconds,closed,2026-02-18 13:50:24+00:00,2026-02-18 15:54:03+00:00,1,0,1
3957882225,64220,DOC: start 3.0.2 whatsnew notes,closed,2026-02-18 13:30:22+00:00,2026-02-18 14:18:34+00:00,2,0,1
3957356700,64219,DOC: Pandas 3.0 blogpost has invalid str migration link,closed,2026-02-18 11:24:28+00:00,2026-02-18 15:46:37+00:00,1,0,1
3957134601,64218,CI: Use scientific-python/upload-nightly-action for nightly wheels,closed,2026-02-18 10:32:19+00:00,2026-02-19 18:33:07+00:00,2,1,1
3956988630,64217,DOC: update maintainers release guide,closed,2026-02-18 09:59:56+00:00,2026-02-18 18:52:07+00:00,1,0,1
3956559712,64216,Backport PR #64211 on branch 3.0.x (CI: Fix regex in docbuild-and-upload.yml),closed,2026-02-18 08:19:52+00:00,2026-02-18 09:16:24+00:00,0,0,1
3956255271,64214,DOC: Clarify deprecation and removal of Substitution and Appender classes,closed,2026-02-18 06:43:40+00:00,2026-02-18 18:04:17+00:00,2,0,1
3955874087,64213,BUG: Fix test_assignment_not_inplace incorrect assertion,closed,2026-02-18 04:27:43+00:00,2026-02-18 21:58:54+00:00,1,0,1
3955428145,64212,depr: offset name,closed,2026-02-18 01:35:27+00:00,2026-02-28 19:40:27+00:00,11,10,1
3955177268,64211,CI: Fix regex in docbuild-and-upload.yml,closed,2026-02-17 23:58:01+00:00,2026-02-18 08:19:44+00:00,2,0,1
3955036604,64210,CLN: assorted cleanups,closed,2026-02-17 23:02:36+00:00,2026-02-18 18:54:50+00:00,1,0,1
3955002187,64209,CLN: remove unused attributes from TimeSeries_DateLocator/Formatter,closed,2026-02-17 22:49:42+00:00,2026-02-18 18:55:47+00:00,1,0,1
3954903842,64208,BUG: test_assignment_not_inplace incorrectly xfailed due to wrong assertion,closed,2026-02-17 22:18:15+00:00,2026-02-18 21:58:55+00:00,5,0,1
3954767549,64207,DEPR: Offset.name,closed,2026-02-17 21:34:42+00:00,2026-02-28 19:40:28+00:00,2,10,1
3954650646,64206,RLS: 3.0.1 ,closed,2026-02-17 20:59:23+00:00,2026-02-17 20:59:59+00:00,0,0,1
3954588476,64205,REF: inline period_array,closed,2026-02-17 20:42:52+00:00,2026-02-18 15:35:04+00:00,5,0,1
3954568880,64204,[backport 3.0.x] ENH: Add item() method to ExtensionArray class (#64134),closed,2026-02-17 20:37:40+00:00,2026-02-17 20:39:40+00:00,0,0,1
3954528672,64203,DOC: add py:type targets for typing aliases,closed,2026-02-17 20:26:49+00:00,2026-04-09 22:09:07+00:00,3,51,1
3953929665,64202,BUG: Fix precision loss in to_numeric for integer-like strings mixed with floats,closed,2026-02-17 17:40:28+00:00,2026-03-26 00:34:03+00:00,10,36,1
3953893356,64201,Backport PR #64199 on branch 3.0.x (DOC: cleanup 3.0.1 whatsnew),closed,2026-02-17 17:32:11+00:00,2026-02-17 17:33:31+00:00,0,0,1
3953779477,64200,RLS: 3.0.1,closed,2026-02-17 17:05:45+00:00,2026-02-17 20:58:55+00:00,0,0,1
3953770566,64199,DOC: cleanup 3.0.1 whatsnew,closed,2026-02-17 17:03:33+00:00,2026-02-17 17:31:40+00:00,0,0,1
3953422382,64197,[backport 3.0.x] BUG: Fix read_hdf failing on generic datetime64 dtype (#64008),closed,2026-02-17 15:45:50+00:00,2026-02-17 16:50:42+00:00,0,0,1
3953129097,64194,"[backport 3.0.x] BUG: use fill_null fallback for bug in pyarrow 21 on Windows (fixes join, fillna, duplicated, etc with pyarrow-backed arrays) (#64081)",closed,2026-02-17 14:45:48+00:00,2026-02-17 15:47:32+00:00,0,0,1
3953042096,64193,Fix 64188 : DOC/IO: Fix json_normalize with null items and improve User Guide documentation,closed,2026-02-17 14:27:27+00:00,2026-04-09 22:13:24+00:00,2,51,1
3953039853,64192,DOC: Version 3.0.0 has does not mention deprecation of non-keyword agruments in to_excel,closed,2026-02-17 14:26:57+00:00,2026-02-18 04:26:29+00:00,3,0,1
3953023880,64191,correct Dataframe.kurt(osis) -> DataFrame.kurt(osis),closed,2026-02-17 14:23:19+00:00,2026-02-18 18:56:22+00:00,1,1,1
3952933582,64189,"""Backport PR #64092 on branch 2.3.x (BUG: DataFrame.loc fills b'' instead of NaN when adding new row and columns simultaneously (#58316))""",closed,2026-02-17 14:03:55+00:00,2026-02-17 14:05:49+00:00,1,0,1
3952691990,64188,BUG: normalize_json no longer supports top-level missing entries,closed,2026-02-17 13:07:23+00:00,2026-03-25 09:03:42+00:00,1,35,1
3952676487,64187,Backport PR #64122 on branch 3.0.x (REG: Allow RE2 syntax in str.contains and str.replace ),closed,2026-02-17 13:03:59+00:00,2026-02-17 14:40:52+00:00,0,0,1
3952507776,64186,Backport PR #64185 on branch 3.0.x (TST: remove fixed xfail for PyArrow 23.0.1),closed,2026-02-17 12:21:05+00:00,2026-02-17 14:39:33+00:00,0,0,1
3952184306,64185,TST: remove fixed xfail for PyArrow 23.0.1,closed,2026-02-17 11:02:54+00:00,2026-02-17 12:20:58+00:00,1,0,1
3951753368,64183,BUG: fix indexing a SparseArray with len(arr) index returning fill value instead of raising,closed,2026-02-17 09:31:17+00:00,2026-03-12 16:14:07+00:00,2,23,1
3951486423,64182,DOC: Fix ES01 for pandas.Series,closed,2026-02-17 08:27:07+00:00,2026-02-18 18:57:33+00:00,1,1,1
3951436823,64181,TST/CLN: remove unnecessary left-over usage of using_infer_string in pytables tests,closed,2026-02-17 08:12:34+00:00,2026-02-18 19:02:48+00:00,1,1,1
3951386981,64180,BUG: to_hdf on dataframe with string column failing with compression,closed,2026-02-17 07:57:56+00:00,2026-03-26 19:30:44+00:00,4,37,1
3950438014,64179,DOC: Add non-inclusive partial string indexing example to indexing.rst,closed,2026-02-17 02:32:04+00:00,2026-03-07 22:47:24+00:00,1,18,1
3950010967,64178,Draft for debug only: Fix git fetch command,closed,2026-02-16 23:49:47+00:00,2026-02-17 00:10:12+00:00,1,0,1
3949998838,64177,STY: Fix ruff error in construction.py,closed,2026-02-16 23:44:12+00:00,2026-02-17 00:45:12+00:00,1,0,1
3949964869,64176,DOC: Correct two typos in pandas documentation,closed,2026-02-16 23:25:37+00:00,2026-02-17 03:27:21+00:00,1,0,1
3949883272,64175,Backport PR #64168 on branch 3.0.x (TST: add legacy file generation and tests for HDF5),closed,2026-02-16 22:51:46+00:00,2026-02-17 03:26:16+00:00,0,0,1
3949676602,64172,DOC: Redundant and misspelled command in docs,closed,2026-02-16 21:42:18+00:00,2026-02-17 08:39:45+00:00,1,0,1
3949555655,64171,DOC: Fix redundant git fetch command,closed,2026-02-16 21:00:56+00:00,2026-02-17 08:39:44+00:00,5,0,1
3949449618,64170,DOC Fix typo - Add missing hyphen in compound adjective,closed,2026-02-16 20:29:34+00:00,2026-02-17 05:36:26+00:00,0,0,1
3948927676,64169,TST: Add regression test for GH#54627,closed,2026-02-16 17:58:05+00:00,2026-03-06 20:59:46+00:00,2,18,1
3948589849,64168,TST: add legacy file generation and tests for HDF5,closed,2026-02-16 16:34:29+00:00,2026-02-16 22:51:14+00:00,1,0,1
3948505989,64167,TYP: enable mypy for pandas.io.xml,closed,2026-02-16 16:12:41+00:00,2026-02-16 19:46:32+00:00,1,0,1
